BOOK,CHAPTER,VERSE,DESCRIPTION
NIV,8,21,"The Lord smelled the pleasing aroma and said in his heart: ""Never again will I curse the ground because of man, even though every inclination of his heart is evil from childhood. And never again will I destroy all living creatures, as I have done."
NIV,8,22,"""As long as the earth endures, seedtime and harvest, cold and heat, summer and winter, day and night will never cease."""
NIV,9,1,"Then God blessed Noah and his sons, saying to them, ""Be fruitful and increase in number and fill the earth."
NIV,9,2,"The fear and dread of you will fall upon all the beasts of the earth and all the birds of the air, upon every creature that moves along the ground, and upon all the fish of the sea; they are given into your hands."
NIV,9,3,"Everything that lives and moves will be food for you. Just as I gave you the green plants, I now give you everything."
NIV,9,4,"""But you must not eat meat that has its lifeblood still in it."
NIV,9,5,"And for your lifeblood I will surely demand an accounting. I will demand an accounting from every animal. And from each man, too, I will demand an accounting for the life of his fellow man."
NIV,9,6,"""Whoever sheds the blood of man, by man shall his blood be shed; for in the image of God has God made man."
NIV,9,7,"As for you, be fruitful and increase in number; multiply on the earth and increase upon it."""
NIV,9,8,Then God said to Noah and to his sons with him:
NIV,9,9,"""I now establish my covenant with you and with your descendants after you"
NIV,9,10,"and with every living creature that was with you-the birds, the livestock and all the wild animals, all those that came out of the ark with you-every living creature on earth."
NIV,9,11,"I establish my covenant with you: Never again will all life be cut off by the waters of a flood; never again will there be a flood to destroy the earth."""
NIV,9,12,"And God said, ""This is the sign of the covenant I am making between me and you and every living creature with you, a covenant for all generations to come:"
NIV,9,13,"I have set my rainbow in the clouds, and it will be the sign of the covenant between me and the earth."
NIV,9,14,"Whenever I bring clouds over the earth and the rainbow appears in the clouds,"
NIV,9,15,I will remember my covenant between me and you and all living creatures of every kind. Never again will the waters become a flood to destroy all life.
NIV,9,16,"Whenever the rainbow appears in the clouds, I will see it and remember the everlasting covenant between God and all living creatures of every kind on the earth."""
NIV,9,17,"So God said to Noah, ""This is the sign of the covenant I have established between me and all life on the earth."""
NIV,9,18,"The sons of Noah who came out of the ark were Shem, Ham and Japheth. (Ham was the father of Canaan.)"
NIV,9,19,"These were the three sons of Noah, and from them came the people who were scattered over the earth."
NIV,9,20,"Noah, a man of the soil, proceeded to plant a vineyard."
NIV,9,21,"When he drank some of its wine, he became drunk and lay uncovered inside his tent."
NIV,9,22,"Ham, the father of Canaan, saw his father's nakedness and told his two brothers outside."
NIV,9,23,But Shem and Japheth took a garment and laid it across their shoulders; then they walked in backward and covered their father's nakedness. Their faces were turned the other way so that they would not see their father's nakedness.
NIV,9,24,"When Noah awoke from his wine and found out what his youngest son had done to him,"
NIV,9,25,"he said, ""Cursed be Canaan! The lowest of slaves will he be to his brothers."""
NIV,9,26,"He also said, ""Blessed be the Lord , the God of Shem! May Canaan be the slave of Shem."
NIV,9,27,"May God extend the territory of Japheth ; may Japheth live in the tents of Shem, and may Canaan be his slave."""
NIV,9,28,After the flood Noah lived 350 years.
NIV,9,29,"Altogether, Noah lived 950 years, and then he died."
NIV,10,1,"This is the account of Shem, Ham and Japheth, Noah's sons, who themselves had sons after the flood. The Japhethites"
NIV,10,2,"The sons of Japheth: Gomer, Magog, Madai, Javan, Tubal, Meshech and Tiras."
NIV,10,3,"The sons of Gomer: Ashkenaz, Riphath and Togarmah."
NIV,10,4,"The sons of Javan: Elishah, Tarshish, the Kittim and the Rodanim."
NIV,10,5,"(From these the maritime peoples spread out into their territories by their clans within their nations, each with its own language.) The Hamites"
NIV,10,6,"The sons of Ham: Cush, Mizraim, Put and Canaan."
NIV,10,7,"The sons of Cush: Seba, Havilah, Sabtah, Raamah and Sabteca. The sons of Raamah: Sheba and Dedan."
NIV,10,8,"Cush was the father of Nimrod, who grew to be a mighty warrior on the earth."
NIV,10,9,"He was a mighty hunter before the Lord ; that is why it is said, ""Like Nimrod, a mighty hunter before the Lord ."""
NIV,10,10,"The first centers of his kingdom were Babylon, Erech, Akkad and Calneh, in Shinar."
NIV,10,11,"From that land he went to Assyria, where he built Nineveh, Rehoboth Ir, Calah"
NIV,10,12,"and Resen, which is between Nineveh and Calah; that is the great city."
NIV,10,13,"Mizraim was the father of the Ludites, Anamites, Lehabites, Naphtuhites,"
NIV,10,14,"Pathrusites, Casluhites (from whom the Philistines came) and Caphtorites."
NIV,10,15,"Canaan was the father of Sidon his firstborn, and of the Hittites,"
NIV,10,16,"Jebusites, Amorites, Girgashites,"
NIV,10,17,"Hivites, Arkites, Sinites,"
NIV,10,18,"Arvadites, Zemarites and Hamathites. Later the Canaanite clans scattered"
NIV,10,19,"and the borders of Canaan reached from Sidon toward Gerar as far as Gaza, and then toward Sodom, Gomorrah, Admah and Zeboiim, as far as Lasha."
NIV,10,20,"These are the sons of Ham by their clans and languages, in their territorie and nations. The Semites"
NIV,10,21,"Sons were also born to Shem, whose older brother was Japheth; Shem was the ancestor of all the sons of Eber."
NIV,10,22,"The sons of Shem: Elam, Asshur, Arphaxad, Lud and Aram."
NIV,10,23,"The sons of Aram: Uz, Hul, Gether and Meshech."
NIV,10,24,"Arphaxad was the father of Shelah, and Shelah the father of Eber."
NIV,10,25,"Two sons were born to Eber: One was named Peleg, because in his time the earth was divided; his brother was named Joktan."
NIV,10,26,"Joktan was the father of Almodad, Sheleph, Hazarmaveth, Jerah,"
NIV,10,27,"Hadoram, Uzal, Diklah,"
NIV,10,28,"Obal, Abimael, Sheba,"
NIV,10,29,"Ophir, Havilah and Jobab. All these were sons of Joktan."
NIV,10,30,"The region where they lived stretched from Mesha toward Sephar, in the eastern hill country."
NIV,10,31,"These are the sons of Shem by their clans and languages, in their territories and nations."
NIV,10,32,"These are the clans of Noah's sons, according to their lines of descent, s within their nations. From these the nations spread out over the earth after the flood."
NIV,11,1,Now the whole world had one language and a common speech.
NIV,11,2,"As men moved eastward, they found a plain in Shinar and settled there."
NIV,11,3,"They said to each other, ""Come, let's make bricks and bake them thoroughly."" They used brick instead of stone, and tar for mortar."
NIV,11,4,"Then they said, ""Come, let us build ourselves a city, with a tower that reaches to the heavens, so that we may make a name for ourselves and not be scattered over the face of the whole earth."""
NIV,11,5,But the Lord came down to see the city and the tower that the men were building.
NIV,11,6,"The Lord said, ""If as one people speaking the same language they have begun to do this, then nothing they plan to do will be impossible for them."
NIV,11,7,"Come, let us go down and confuse their language so they will not understand each other."""
NIV,11,8,"So the Lord scattered them from there over all the earth, and they stopped building the city."
NIV,11,9,That is why it was called Babel - because there the Lord confused the language of the whole world. From there the Lord scattered them over the face of the whole earth.
NIV,11,10,"This is the account of Shem. Two years after the flood, when Shem was"
NIV,11,10,"100 years old, he became the father of Arphaxad."
NIV,11,11,"And after he became the father of Arphaxad, Shem lived 500 years and had other sons and daughters."
NIV,11,12,"When Arphaxad had lived 35 years, he became the father of Shelah."
NIV,11,13,"And after he became the father of Shelah, Arphaxad lived 403 years and had other sons and daughters."
NIV,11,14,"When Shelah had lived 30 years, he became the father of Eber."
NIV,11,15,"And after he became the father of Eber, Shelah lived 403 years and had other sons and daughters."
NIV,11,16,"When Eber had lived 34 years, he became the father of Peleg."
NIV,11,17,"And after he became the father of Peleg, Eber lived 430 years and had other sons and daughters."
NIV,11,18,"When Peleg had lived 30 years, he became the father of Reu."
NIV,11,19,"And after he became the father of Reu, Peleg lived 209 years and had other sons and daughters."
NIV,11,20,"When Reu had lived 32 years, he became the father of Serug."
NIV,11,21,"And after he became the father of Serug, Reu lived 207 years and had other sons and daughters."
NIV,11,22,"When Serug had lived 30 years, he became the father of Nahor."
NIV,11,23,"And after he became the father of Nahor, Serug lived 200 years and had other sons and daughters."
NIV,11,24,"When Nahor had lived 29 years, he became the father of Terah."
NIV,11,25,"And after he became the father of Terah, Nahor lived 119 years and had other sons and daughters."
NIV,11,26,"After Terah had lived 70 years, he became the father of Abram, Nahor and Haran."
NIV,11,27,"This is the account of Terah. Terah became the father of Abram, Nahor and Haran. And Haran became the father of Lot."
NIV,11,28,"While his father Terah was still alive, Haran died in Ur of the Chaldeans, in the land of his birth."
NIV,11,29,"Abram and Nahor both married. The name of Abram's wife was Sarai, and the name of Nahor's wife was Milcah; she was the daughter of Haran, the father of both Milcah and Iscah."
NIV,11,30,Now Sarai was barren; she had no children.
NIV,11,31,"Terah took his son Abram, his grandson Lot son of Haran, and his daughter-in- law Sarai, the wife of his son Abram, and together they set out from Ur of the Chaldeans to go to Canaan. But when they came to Haran, they settled there."
NIV,11,32,"Terah lived 205 years, and he died in Haran."
NIV,12,1,"The Lord had said to Abram, ""Leave your country, your people and your father's household and go to the land I will show you."
NIV,12,2,"""I will make you into a great nation and I will bless you; I will make your name great, and you will be a blessing."
NIV,12,3,"I will bless those who bless you, and whoever curses you I will curse; and all peoples on earth will be blessed through you."""
NIV,12,4,"So Abram left, as the Lord had told him; and Lot went with him. Abram was seventy-five years old when he set out from Haran."
NIV,12,5,"He took his wife Sarai, his nephew Lot, all the possessions they had accumulated and the people they had acquired in Haran, and they set out for the land of Canaan, and they arrived there."
NIV,12,6,Abram traveled through the land as far as the site of the great tree of Moreh at Shechem. At that time the Canaanites were in the land.
NIV,12,7,"The Lord appeared to Abram and said, ""To your offspring I will give this land."" So he built an altar there to the Lord , who had appeared to him."
NIV,12,8,"From there he went on toward the hills east of Bethel and pitched his tent, with Bethel on the west and Ai on the east. There he built an altar to the Lord and called on the name of the Lord ."
NIV,12,9,Then Abram set out and continued toward the Negev.
NIV,12,10,"Now there was a famine in the land, and Abram went down to Egypt to live there for a while because the famine was severe."
NIV,12,11,"As he was about to enter Egypt, he said to his wife Sarai, ""I know what a beautiful woman you are."
NIV,12,12,"When the Egyptians see you, they will say, 'This is his wife.' Then they will kill me but will let you live."
NIV,12,13,"Say you are my sister, so that I will be treated well for your sake and my life will be spared because of you."""
NIV,12,14,"When Abram came to Egypt, the Egyptians saw that she was a very beautiful woman."
NIV,12,15,"And when Pharaoh's officials saw her, they praised her to Pharaoh, and she was taken into his palace."
NIV,12,16,"He treated Abram well for her sake, and Abram acquired sheep and cattle, male and female donkeys, menservants and maidservants, and camels."
NIV,12,17,But the Lord inflicted serious diseases on Pharaoh and his household because of Abram's wife Sarai.
NIV,12,18,"So Pharaoh summoned Abram. ""What have you done to me?"" he said. ""Why didn't you tell me she was your wife?"
NIV,12,19,"Why did you say, 'She is my sister,' so that I took her to be my wife? Now then, here is your wife. Take her and go!"""
NIV,12,20,"Then Pharaoh gave orders about Abram to his men, and they sent him on his way, with his wife and everything he had."
NIV,13,1,"So Abram went up from Egypt to the Negev, with his wife and everything he had, and Lot went with him."
NIV,13,2,Abram had become very wealthy in livestock and in silver and gold.
NIV,13,3,"From the Negev he went from place to place until he came to Bethel, to the place between Bethel and Ai where his tent had been earlier"
NIV,13,4,and where he had first built an altar. There Abram called on the name of the Lord .
NIV,13,5,"Now Lot, who was moving about with Abram, also had flocks and herds and tents."
NIV,13,6,"But the land could not support them while they stayed together, for their possessions were so great that they were not able to stay together."
NIV,13,7,And quarreling arose between Abram's herdsmen and the herdsmen of Lot. The Canaanites and Perizzites were also living in the land at that time.
NIV,13,8,"So Abram said to Lot, ""Let's not have any quarreling between you and me, or between your herdsmen and mine, for we are brothers."
NIV,13,9,"Is not the whole land before you? Let's part company. If you go to the left, I'll go to the right; if you go to the right, I'll go to the left."""
NIV,13,10,"Lot looked up and saw that the whole plain of the Jordan was well watered, like the garden of the Lord , like the land of Egypt, toward Zoar. (This was before the Lord destroyed Sodom and Gomorrah.)"
NIV,13,11,So Lot chose for himself the whole plain of the Jordan and set out toward the east. The two men parted company:
NIV,13,12,"Abram lived in the land of Canaan, while Lot lived among the cities of the plain and pitched his tents near Sodom."
NIV,13,13,Now the men of Sodom were wicked and were sinning greatly against the Lord .
NIV,13,14,"The Lord said to Abram after Lot had parted from him, ""Lift up your eyes from where you are and look north and south, east and west."
NIV,13,15,All the land that you see I will give to you and your offspring forever.
NIV,13,16,"I will make your offspring like the dust of the earth, so that if anyone could count the dust, then your offspring could be counted."
NIV,13,17,"Go, walk through the length and breadth of the land, for I am giving it to you."""
NIV,13,18,"So Abram moved his tents and went to live near the great trees of Mamre at Hebron, where he built an altar to the Lord ."
NIV,14,1,"At this time Amraphel king of Shinar, Arioch king of Ellasar, Kedorlaomer king of Elam and Tidal king of Goiim"
NIV,14,2,"went to war against Bera king of Sodom, Birsha king of Gomorrah, Shinab king of Admah, Shemeber king of Zeboiim, and the king of Bela (that is, Zoar)."
NIV,14,3,All these latter kings joined forces in the Valley of Siddim (the Salt Sea ).
NIV,14,4,"For twelve years they had been subject to Kedorlaomer, but in the thirteenth year they rebelled."
NIV,14,5,"In the fourteenth year, Kedorlaomer and the kings allied with him went out and defeated the Rephaites in Ashteroth Karnaim, the Zuzites in Ham, the Emites in Shaveh Kiriathaim"
NIV,14,6,"and the Horites in the hill country of Seir, as far as El Paran near the desert."
NIV,14,7,"Then they turned back and went to En Mishpat (that is, Kadesh), and they conquered the whole territory of the Amalekites, as well as the Amorites who were living in Hazazon Tamar."
NIV,14,8,"Then the king of Sodom, the king of Gomorrah, the king of Admah, the king of Zeboiim and the king of Bela (that is, Zoar) marched out and drew up their battle lines in the Valley of Siddim"
NIV,14,9,"against Kedorlaomer king of Elam, Tidal king of Goiim, Amraphel king of Shinar and Arioch king of Ellasar-four kings against five."
NIV,14,10,"Now the Valley of Siddim was full of tar pits, and when the kings of Sodom and Gomorrah fled, some of the men fell into them and the rest fled to the hills."
NIV,14,11,The four kings seized all the goods of Sodom and Gomorrah and all their food; then they went away.
NIV,14,12,"They also carried off Abram's nephew Lot and his possessions, since he was living in Sodom."
NIV,14,13,"One who had escaped came and reported this to Abram the Hebrew. Now Abram was living near the great trees of Mamre the Amorite, a brother of Eshcol and Aner, all of whom were allied with Abram."
NIV,14,14,"When Abram heard that his relative had been taken captive, he called out the"
NIV,14,14,318 trained men born in his household and went in pursuit as far as Dan.
NIV,14,15,"During the night Abram divided his men to attack them and he routed them, pursuing them as far as Hobah, north of Damascus."
NIV,14,16,"He recovered all the goods and brought back his relative Lot and his possessions, together with the women and the other people."
NIV,14,17,"After Abram returned from defeating Kedorlaomer and the kings allied with him, the king of Sodom came out to meet him in the Valley of Shaveh (that is the King's Valley)."
NIV,14,18,"Then Melchizedek king of Salem brought out bread and wine. He was priest of God Most High,"
NIV,14,19,"and he blessed Abram, saying, ""Blessed be Abram by God Most High, Creator of heaven and earth."
NIV,14,20,"And blessed be God Most High, who delivered your enemies into your hand."" Then Abram gave him a tenth of everything."
NIV,14,21,"The king of Sodom said to Abram, ""Give me the people and keep the goods for yourself."""
NIV,14,22,"But Abram said to the king of Sodom, ""I have raised my hand to the Lord , God Most High, Creator of heaven and earth, and have taken an oath"
NIV,14,23,"that I will accept nothing belonging to you, not even a thread or the thong of a sandal, so that you will never be able to say, 'I made Abram rich.'"
NIV,14,24,"I will accept nothing but what my men have eaten and the share that belongs to the men who went with me-to Aner, Eshcol and Mamre. Let them have their share."""
NIV,15,1,"After this, the word of the Lord came to Abram in a vision: ""Do not be afraid, Abram. I am your shield, your very great reward. "" ,"
NIV,15,2,"But Abram said, ""O Sovereign Lord , what can you give me since I remain childless and the one who will inherit my estate is Eliezer of Damascus?"""
NIV,15,3,"And Abram said, ""You have given me no children; so a servant in my household will be my heir."""
NIV,15,4,"Then the word of the Lord came to him: ""This man will not be your heir, but a son coming from your own body will be your heir."""
NIV,15,5,"He took him outside and said, ""Look up at the heavens and count the stars-if indeed you can count them."" Then he said to him, ""So shall your offspring be."""
NIV,15,6,"Abram believed the Lord , and he credited it to him as righteousness."
NIV,15,7,"He also said to him, ""I am the Lord , who brought you out of Ur of the Chaldeans to give you this land to take possession of it."""
NIV,15,8,"But Abram said, ""O Sovereign Lord , how can I know that I will gain possession of it?"""
NIV,15,9,"So the Lord said to him, ""Bring me a heifer, a goat and a ram, each three years old, along with a dove and a young pigeon."""
NIV,15,10,"Abram brought all these to him, cut them in two and arranged the halves opposite each other; the birds, however, he did not cut in half."
NIV,15,11,"Then birds of prey came down on the carcasses, but Abram drove them away."
NIV,15,12,"As the sun was setting, Abram fell into a deep sleep, and a thick and dreadful darkness came over him."
NIV,15,13,"Then the Lord said to him, ""Know for certain that your descendants will be strangers in a country not their own, and they will be enslaved and mistreated four hundred years."
NIV,15,14,"But I will punish the nation they serve as slaves, and afterward they will come out with great possessions."
NIV,15,15,"You, however, will go to your fathers in peace and be buried at a good old age."
NIV,15,16,"In the fourth generation your descendants will come back here, for the sin of the Amorites has not yet reached its full measure."""
NIV,15,17,"When the sun had set and darkness had fallen, a smoking firepot with a blazing torch appeared and passed between the pieces."
NIV,15,18,"On that day the Lord made a covenant with Abram and said, ""To your descendants I give this land, from the river of Egypt to the great river, the Euphrates-"
NIV,15,19,"the land of the Kenites, Kenizzites, Kadmonites,"
NIV,15,20,"Hittites, Perizzites, Rephaites,"
NIV,15,21,"Amorites, Canaanites, Girgashites and Jebusites."""
NIV,16,1,"Now Sarai, Abram's wife, had borne him no children. But she had an Egyptian maidservant named Hagar;"
NIV,16,2,"so she said to Abram, ""The Lord has kept me from having children. Go, sleep with my maidservant; perhaps I can build a family through her."" Abram agreed to what Sarai said."
NIV,16,3,"So after Abram had been living in Canaan ten years, Sarai his wife took her Egyptian maidservant Hagar and gave her to her husband to be his wife."
NIV,16,4,"He slept with Hagar, and she conceived. When she knew she was pregnant, she began to despise her mistress."
NIV,16,5,"Then Sarai said to Abram, ""You are responsible for the wrong I am suffering. I put my servant in your arms, and now that she knows she is pregnant, she despises me. May the Lord judge between you and me."""
NIV,16,6,"""Your servant is in your hands,"" Abram said. ""Do with her whatever you think best."" Then Sarai mistreated Hagar; so she fled from her."
NIV,16,7,The angel of the Lord found Hagar near a spring in the desert; it was the spring that is beside the road to Shur.
NIV,16,8,"And he said, ""Hagar, servant of Sarai, where have you come from, and where are you going?"" ""I'm running away from my mistress Sarai,"" she answered."
NIV,16,9,"Then the angel of the Lord told her, ""Go back to your mistress and submit to her."""
NIV,16,10,"The angel added, ""I will so increase your descendants that they will be too numerous to count."""
NIV,16,11,"The angel of the Lord also said to her: ""You are now with child and you will have a son. You shall name him Ishmael, for the Lord has heard of your misery."
NIV,16,12,"He will be a wild donkey of a man; his hand will be against everyone and everyone's hand against him, and he will live in hostility toward all his brothers."""
NIV,16,13,"She gave this name to the Lord who spoke to her: ""You are the God who sees me,"" for she said, ""I have now seen the One who sees me."""
NIV,16,14,"That is why the well was called Beer Lahai Roi ; it is still there, between Kadesh and Bered."
NIV,16,15,"So Hagar bore Abram a son, and Abram gave the name Ishmael to the son she had borne."
NIV,16,16,Abram was eighty-six years old when Hagar bore him Ishmael.
NIV,17,1,"When Abram was ninety-nine years old, the Lord appeared to him and said, ""I am God Almighty ; walk before me and be blameless."
NIV,17,2,"I will confirm my covenant between me and you and will greatly increase your numbers."""
NIV,17,3,"Abram fell facedown, and God said to him,"
NIV,17,4,"""As for me, this is my covenant with you: You will be the father of many nations."
NIV,17,5,"No longer will you be called Abram ; your name will be Abraham, for I have made you a father of many nations."
NIV,17,6,"I will make you very fruitful; I will make nations of you, and kings will come from you."
NIV,17,7,"I will establish my covenant as an everlasting covenant between me and you and your descendants after you for the generations to come, to be your God and the God of your descendants after you."
NIV,17,8,"The whole land of Canaan, where you are now an alien, I will give as an everlasting possession to you and your descendants after you; and I will be thei God."""
NIV,17,9,"Then God said to Abraham, ""As for you, you must keep my covenant, you and your descendants after you for the generations to come."
NIV,17,10,"This is my covenant with you and your descendants after you, the covenant you are to keep: Every male among you shall be circumcised."
NIV,17,11,"You are to undergo circumcision, and it will be the sign of the covenant between me and you."
NIV,17,12,"For the generations to come every male among you who is eight days old must be circumcised, including those born in your household or bought with money from a foreigner-those who are not your offspring."
NIV,17,13,"Whether born in your household or bought with your money, they must be circumcised. My covenant in your flesh is to be an everlasting covenant."
NIV,17,14,"Any uncircumcised male, who has not been circumcised in the flesh, will be cu off from his people; he has broken my covenant."""
NIV,17,15,"God also said to Abraham, ""As for Sarai your wife, you are no longer to call her Sarai; her name will be Sarah."
NIV,17,16,"I will bless her and will surely give you a son by her. I will bless her so that she will be the mother of nations; kings of peoples will come from her."""
NIV,17,17,"Abraham fell facedown; he laughed r and said to himself, ""Will a son be born to a man a hundred years old? Will Sarah bear a child at the age of ninety?"""
NIV,17,18,"And Abraham said to God, ""If only Ishmael might live under your blessing!"""
