BOOK,CHAPTER,VERSE,DESCRIPTION
NIV,17,19,"Then God said, ""Yes, but your wife Sarah will bear you a son, and you will call him Isaac. I will establish my covenant with him as an everlasting covenant for his descendants after him."
NIV,17,20,"And as for Ishmael, I have heard you: I will surely bless him; I will make him fruitful and will greatly increase his numbers. He will be the father of twelve rulers, and I will make him into a great nation."
NIV,17,21,"But my covenant I will establish with Isaac, whom Sarah will bear to you by this time next year."""
NIV,17,22,"When he had finished speaking with Abraham, God went up from him."
NIV,17,23,"On that very day Abraham took his son Ishmael and all those born in his household or bought with his money, t every male in his household, and circumcised them, as God told him."
NIV,17,24,"Abraham was ninety-nine years old when he was circumcised,"
NIV,17,25,and his son Ishmael was thirteen;
NIV,17,26,Abraham and his son Ishmael were both circumcised on that same day.
NIV,17,27,"And every male in Abraham's household, including those born in his household or bought from a foreigner, was circumcised with him."
NIV,18,1,The Lord appeared to Abraham near the great trees of Mamre while he was sitting at the entrance to his tent in the heat of the day.
NIV,18,2,"Abraham looked up and saw three men standing nearby. When he saw them, he hurried from the entrance of his tent to meet them and bowed low to the ground."
NIV,18,3,"He said, ""If I have found favor in your eyes, my lord, do not pass your servant by."
NIV,18,4,"Let a little water be brought, and then you may all wash your feet and rest under this tree."
NIV,18,5,"Let me get you something to eat, so you can be refreshed and then go on your way-now that you have come to your servant."" ""Very well,"" they answered, ""do as you say."""
NIV,18,6,"So Abraham hurried into the tent to Sarah. ""Quick,"" he said, ""get three seahs of fine flour and knead it and bake some bread."""
NIV,18,7,"Then he ran to the herd and selected a choice, tender calf and gave it to a servant, who hurried to prepare it."
NIV,18,8,"He then brought some curds and milk and the calf that had been prepared, and set these before them. While they ate, he stood near them under a tree."
NIV,18,9,"""Where is your wife Sarah?"" they asked him. ""There, in the tent,"" he said."
NIV,18,10,"Then the Lord said, ""I will surely return to you about this time next year, and Sarah your wife will have a son."" Now Sarah was listening at the entrance to the tent, which was behind him."
NIV,18,11,"Abraham and Sarah were already old and well advanced in years, and Sarah was past the age of childbearing."
NIV,18,12,"So Sarah laughed to herself as she thought, ""After I am worn out and my master is old, will I now have this pleasure?"""
NIV,18,13,"Then the Lord said to Abraham, ""Why did Sarah laugh and say, 'Will I really have a child, now that I am old?'"
NIV,18,14,"Is anything too hard for the Lord ? I will return to you at the appointed time next year and Sarah will have a son."""
NIV,18,15,"Sarah was afraid, so she lied and said, ""I did not laugh."" But he said, ""Yes, you did laugh."""
NIV,18,16,"When the men got up to leave, they looked down toward Sodom, and Abraham walked along with them to see them on their way."
NIV,18,17,"Then the Lord said, ""Shall I hide from Abraham what I am about to do?"
NIV,18,18,"Abraham will surely become a great and powerful nation, and all nations on earth will be blessed through him."
NIV,18,19,"For I have chosen him, so that he will direct his children and his household after him to keep the way of the Lord by doing what is right and just, so that the Lord will bring about for Abraham what he has promised him."""
NIV,18,20,"Then the Lord said, ""The outcry against Sodom and Gomorrah is so great and their sin so grievous"
NIV,18,21,"that I will go down and see if what they have done is as bad as the outcry that has reached me. If not, I will know."""
NIV,18,22,"The men turned away and went toward Sodom, but Abraham remained standing before the Lord ."
NIV,18,23,"Then Abraham approached him and said: ""Will you sweep away the righteous with the wicked?"
NIV,18,24,What if there are fifty righteous people in the city? Will you really sweep it away and not spare the place for the sake of the fifty righteous people in it?
NIV,18,25,"Far be it from you to do such a thing-to kill the righteous with the wicked, treating the righteous and the wicked alike. Far be it from you! Will not the Judge of all the earth do right?"""
NIV,18,26,"The Lord said, ""If I find fifty righteous people in the city of Sodom, I will spare the whole place for their sake."""
NIV,18,27,"Then Abraham spoke up again: ""Now that I have been so bold as to speak to the Lord, though I am nothing but dust and ashes,"
NIV,18,28,"what if the number of the righteous is five less than fifty? Will you destroy the whole city because of five people?"" ""If I find forty-five there,"" he said, ""I will not destroy it."""
NIV,18,29,"Once again he spoke to him, ""What if only forty are found there?"" He said, ""For the sake of forty, I will not do it."""
NIV,18,30,"Then he said, ""May the Lord not be angry, but let me speak. What if only thirty can be found there?"" He answered, ""I will not do it if I find thirty there."""
NIV,18,31,"Abraham said, ""Now that I have been so bold as to speak to the Lord, what if only twenty can be found there?"" He said, ""For the sake of twenty, I will not destroy it."""
NIV,18,32,"Then he said, ""May the Lord not be angry, but let me speak just once more. What if only ten can be found there?"" He answered, ""For the sake of ten, I will not destroy it."""
NIV,18,33,"When the Lord had finished speaking with Abraham, he left, and Abraham returned home."
NIV,19,1,"The two angels arrived at Sodom in the evening, and Lot was sitting in the gateway of the city. When he saw them, he got up to meet them and bowed down with his face to the ground."
NIV,19,2,"""My lords,"" he said, ""please turn aside to your servant's house. You can wash your feet and spend the night and then go on your way early in the morning."" ""No,"" they answered, ""we will spend the night in the square."""
NIV,19,3,"But he insisted so strongly that they did go with him and entered his house. He prepared a meal for them, baking bread without yeast, and they ate."
NIV,19,4,"Before they had gone to bed, all the men from every part of the city of Sodom- both young and old-surrounded the house."
NIV,19,5,"They called to Lot, ""Where are the men who came to you tonight? Bring them out to us so that we can have sex with them."""
NIV,19,6,Lot went outside to meet them and shut the door behind him
NIV,19,7,"and said, ""No, my friends. Don't do this wicked thing."
NIV,19,8,"Look, I have two daughters who have never slept with a man. Let me bring them out to you, and you can do what you like with them. But don't do anything to these men, for they have come under the protection of my roof."""
NIV,19,9,"""Get out of our way,"" they replied. And they said, ""This fellow came here as an alien, and now he wants to play the judge! We'll treat you worse than them."" They kept bringing pressure on Lot and moved forward to break down the door."
NIV,19,10,But the men inside reached out and pulled Lot back into the house and shut the door.
NIV,19,11,"Then they struck the men who were at the door of the house, young and old, with blindness so that they could not find the door."
NIV,19,12,"The two men said to Lot, ""Do you have anyone else here-sons-in-law, sons or daughters, or anyone else in the city who belongs to you? Get them out of here,"
NIV,19,13,"because we are going to destroy this place. The outcry to the Lord against its people is so great that he has sent us to destroy it."""
NIV,19,14,"So Lot went out and spoke to his sons- in-law, who were pledged to marry his daughters. He said, ""Hurry and get out of this place, because the Lord is about to destroy the city!"" But his sons-in- law thought he was joking."
NIV,19,15,"With the coming of dawn, the angels urged Lot, saying, ""Hurry! Take your wife and your two daughters who are here, or you will be swept away when the city is punished."""
NIV,19,16,"When he hesitated, the men grasped his hand and the hands of his wife and of his two daughters and led them safely out of the city, for the Lord was merciful to them."
NIV,19,17,"As soon as they had brought them out, one of them said, ""Flee for your lives! Don't look back, and don't stop anywhere in the plain! Flee to the mountains or you will be swept away!"""
NIV,19,18,"But Lot said to them, ""No, my lords, please!"
NIV,19,19,"Your servant has found favor in your eyes, and you have shown great kindness to me in sparing my life. But I can't flee to the mountains; this disaster will overtake me, and I'll die."
NIV,19,20,"Look, here is a town near enough to run to, and it is small. Let me flee to it-i is very small, isn't it? Then my life will b spared."""
NIV,19,21,"He said to him, ""Very well, I will grant this request too; I will not overthrow the town you speak of."
NIV,19,22,"But flee there quickly, because I cannot do anything until you reach it."" (That is why the town was called Zoar. )"
NIV,19,23,"By the time Lot reached Zoar, the sun had risen over the land."
NIV,19,24,Then the Lord rained down burning sulfur on Sodom and Gomorrah-from the Lord out of the heavens.
NIV,19,25,"Thus he overthrew those cities and the entire plain, including all those living in the cities-and also the vegetation in the land."
NIV,19,26,"But Lot's wife looked back, and she became a pillar of salt."
NIV,19,27,Early the next morning Abraham got up and returned to the place where he had stood before the Lord .
NIV,19,28,"He looked down toward Sodom and Gomorrah, toward all the land of the plain, and he saw dense smoke rising from the land, like smoke from a furnace."
NIV,19,29,"So when God destroyed the cities of the plain, he remembered Abraham, and he brought Lot out of the catastrophe that overthrew the cities where Lot had lived."
NIV,19,30,"Lot and his two daughters left Zoar t and settled in the mountains, for he was e afraid to stay in Zoar. He and his two daughters lived in a cave."
NIV,19,31,"One day the older daughter said to the younger, ""Our father is old, and there is no man around here to lie with us, as is the custom all over the earth."
NIV,19,32,"Let's get our father to drink wine and then lie with him and preserve our family line through our father."""
NIV,19,33,"That night they got their father to drink wine, and the older daughter went in and lay with him. He was not aware of it when she lay down or when she got up."
NIV,19,34,"The next day the older daughter said to the younger, ""Last night I lay with my father. Let's get him to drink wine again tonight, and you go in and lie with him so we can preserve our family line through our father."""
NIV,19,35,"So they got their father to drink wine that night also, and the younger daughter went and lay with him. Again he was not aware of it when she lay down or when she got up."
NIV,19,36,So both of Lot's daughters became pregnant by their father.
NIV,19,37,"The older daughter had a son, and she named him Moab ; he is the father of the Moabites of today."
NIV,19,38,"The younger daughter also had a son, and she named him Ben-Ammi ; he is the father of the Ammonites of today."
NIV,20,1,"Now Abraham moved on from there into the region of the Negev and lived between Kadesh and Shur. For a while he stayed in Gerar,"
NIV,20,2,"and there Abraham said of his wife Sarah, ""She is my sister."" Then Abimelech king of Gerar sent for Sarah and took her."
NIV,20,3,"But God came to Abimelech in a dream one night and said to him, ""You are as good as dead because of the woman you have taken; she is a married woman."""
NIV,20,4,"Now Abimelech had not gone near her, so he said, ""Lord, will you destroy an innocent nation?"
NIV,20,5,"Did he not say to me, 'She is my sister, and didn't she also say, 'He is my brother'? I have done this with a clear conscience and clean hands."""
NIV,20,6,"Then God said to him in the dream, ""Yes, I know you did this with a clear conscience, and so I have kept you from sinning against me. That is why I did not let you touch her."
NIV,20,7,"Now return the man's wife, for he is a prophet, and he will pray for you and you will live. But if you do not return her, you may be sure that you and all yours will die."""
NIV,20,8,"Early the next morning Abimelech summoned all his officials, and when he told them all that had happened, they were very much afraid."
NIV,20,9,"Then Abimelech called Abraham in and said, ""What have you done to us? How have I wronged you that you have brought such great guilt upon me and my kingdom? You have done things to me that should not be done."""
NIV,20,10,"And Abimelech asked Abraham, ""What was your reason for doing this?"""
NIV,20,11,"Abraham replied, ""I said to myself, 'There is surely no fear of God in this place, and they will kill me because of my wife.'"
NIV,20,12,"Besides, she really is my sister, the daughter of my father though not of my mother; and she became my wife."
NIV,20,13,"And when God had me wander from my father's household, I said to her, 'This is how you can show your love to ' me: Everywhere we go, say of me, ""He is my brother."" ' """
NIV,20,14,"Then Abimelech brought sheep and cattle and male and female slaves and gave them to Abraham, and he returned Sarah his wife to him."
NIV,20,15,"And Abimelech said, ""My land is before you; live wherever you like."""
NIV,20,16,"To Sarah he said, ""I am giving your brother a thousand shekels of silver. This is to cover the offense against you before all who are with you; you are completely vindicated."""
NIV,20,17,"Then Abraham prayed to God, and God healed Abimelech, his wife and his slave girls so they could have children again,"
NIV,20,18,for the Lord had closed up every womb in Abimelech's household because of Abraham's wife Sarah.
NIV,21,1,"Now the Lord was gracious to Sarah as he had said, and the Lord did for Sarah what he had promised."
NIV,21,2,"Sarah became pregnant and bore a son to Abraham in his old age, at the very time God had promised him."
NIV,21,3,Abraham gave the name Isaac to the son Sarah bore him.
NIV,21,4,"When his son Isaac was eight days old, Abraham circumcised him, as God commanded him."
NIV,21,5,Abraham was a hundred years old when his son Isaac was born to him.
NIV,21,6,"Sarah said, ""God has brought me laughter, and everyone who hears about this will laugh with me."""
NIV,21,7,"And she added, ""Who would have said to Abraham that Sarah would nurse children? Yet I have borne him a son in his old age."""
NIV,21,8,"The child grew and was weaned, and on the day Isaac was weaned Abraham held a great feast."
NIV,21,9,"But Sarah saw that the son whom Hagar the Egyptian had borne to Abraham was mocking,"
NIV,21,10,"and she said to Abraham, ""Get rid of that slave woman and her son, for that slave woman's son will never share in the inheritance with my son Isaac."""
NIV,21,11,The matter distressed Abraham greatly because it concerned his son.
NIV,21,12,"But God said to him, ""Do not be so distressed about the boy and your maidservant. Listen to whatever Sarah tells you, because it is through Isaac that your offspring will be reckoned."
NIV,21,13,"I will make the son of the maidservant into a nation also, because he is your offspring."""
NIV,21,14,Early the next morning Abraham took some food and a skin of water and gave them to Hagar. He set them on her shoulders and then sent her off with the boy. She went on her way and wandered in the desert of Beersheba.
NIV,21,15,"When the water in the skin was gone, she put the boy under one of the bushes."
NIV,21,16,"Then she went off and sat down nearby, about a bowshot away, for she thought, ""I cannot watch the boy die."" And as she sat there nearby, she began to sob."
NIV,21,17,"God heard the boy crying, and the angel of God called to Hagar from heaven and said to her, ""What is the matter, Hagar? Do not be afraid; God has heard the boy crying as he lies there."
NIV,21,18,"Lift the boy up and take him by the hand, for I will make him into a great nation."""
NIV,21,19,Then God opened her eyes and she saw a well of water. So she went and filled the skin with water and gave the boy a drink.
NIV,21,20,God was with the boy as he grew up. He lived in the desert and became an archer.
NIV,21,21,"While he was living in the Desert of Paran, his mother got a wife for him from Egypt."
NIV,21,22,"At that time Abimelech and Phicol the commander of his forces said to Abraham, ""God is with you in everything you do."
NIV,21,23,"Now swear to me here before God that you will not deal falsely with me or my children or my descendants. Show to me and the country where you are living as an alien the same kindness I have shown to you."""
NIV,21,24,"Abraham said, ""I swear it."""
NIV,21,25,Then Abraham complained to Abimelech about a well of water that Abimelech's servants had seized.
NIV,21,26,"But Abimelech said, ""I don't know who has done this. You did not tell me, and I heard about it only today."""
NIV,21,27,"So Abraham brought sheep and cattle and gave them to Abimelech, and the two men made a treaty."
NIV,21,28,"Abraham set apart seven ewe lambs from the flock,"
NIV,21,29,"and Abimelech asked Abraham, ""What is the meaning of these seven ewe lambs you have set apart by themselves?"""
NIV,21,30,"He replied, ""Accept these seven lambs from my hand as a witness that I dug this well."""
NIV,21,31,"So that place was called Beersheba, because the two men swore an oath there."
NIV,21,32,"After the treaty had been made at Beersheba, Abimelech and Phicol the commander of his forces returned to the land of the Philistines."
NIV,21,33,"Abraham planted a tamarisk tree in Beersheba, and there he called upon the name of the Lord , the Eternal God."
NIV,21,34,And Abraham stayed in the land of the Philistines for a long time.
NIV,22,1,"Some time later God tested Abraham. He said to him, ""Abraham!"" ""Here I am,"" he replied."
NIV,22,2,"Then God said, ""Take your son, your only son, Isaac, whom you love, and go to the region of Moriah. Sacrifice him there as a burnt offering on one of the mountains I will tell you about."""
NIV,22,3,"Early the next morning Abraham got up and saddled his donkey. He took with him two of his servants and his son Isaac. When he had cut enough wood for the burnt offering, he set out for the place God had told him about."
NIV,22,4,On the third day Abraham looked up and saw the place in the distance.
NIV,22,5,"He said to his servants, ""Stay here with the donkey while I and the boy go over there. We will worship and then we will come back to you."""
NIV,22,6,"Abraham took the wood for the burnt offering and placed it on his son Isaac, and he himself carried the fire and the knife. As the two of them went on together,"
NIV,22,7,"Isaac spoke up and said to his father Abraham, ""Father?"" ""Yes, my son?"" Abraham replied. ""The fire and wood are here,"" Isaac said, ""but where is the lamb for the burnt offering?"""
NIV,22,8,"Abraham answered, ""God himself will provide the lamb for the burnt offering, my son."" And the two of them went on together."
NIV,22,9,"When they reached the place God had told him about, Abraham built an altar there and arranged the wood on it. He bound his son Isaac and laid him on the altar, on top of the wood."
NIV,22,10,Then he reached out his hand and took the knife to slay his son.
NIV,22,11,"But the angel of the Lord called out to him from heaven, ""Abraham! Abraham!"" ""Here I am,"" he replied. 12 ""Do not lay a hand on the boy,"" he said. ""Do not do anything to him. Now I know that you fear God, because you have not withheld from me your son, your only son."""
NIV,22,11,"13 Abraham looked up and there in a thicket he saw a ram caught by its horns. He went over and took the ram and sacrificed it as a burnt offering instead of his son. 14 So Abraham called that place The Lord Will Provide. And to this day it is said, ""On the mountain of the Lord it will be provided."" 15 The angel of the Lord called to Abraham from heaven a second time"
NIV,22,11,"16 and said, ""I swear by myself, declares the Lord , that because you have done this and have not withheld your son, your only son,"
NIV,22,11,17 I will surely bless you and make your descendants as numerous as the stars in the sky and as the sand on the seashore. Your descendants will take possession of the cities of their enemies
NIV,22,11,"18 and through your offspring all nations on earth will be blessed, because you have obeyed me."""
NIV,22,11,"19 Then Abraham returned to his servants, and they set off together for Beersheba. And Abraham stayed in Beersheba."
NIV,22,11,"20 Some time later Abraham was told, ""Milcah is also a mother; she has borne sons to your brother Nahor:"
NIV,22,11,"21 Uz the firstborn, Buz his brother, Kemuel (the father of Aram),"
NIV,22,11,"22 Kesed, Hazo, Pildash, Jidlaph and Bethuel."""
NIV,23,1,Bethuel became the father of Rebekah. Milcah bore these eight sons to Abraham's brother Nahor.
NIV,24,1,"His concubine, whose name was Reumah, also had sons: Tebah, Gaham, Tahash and Maacah."
NIV,23,1,Sarah lived to be a hundred and twenty-seven years old.
NIV,23,2,"She died at Kiriath Arba (that is, Hebron) in the land of Canaan, and Abraham went to mourn for Sarah and to weep over her."
NIV,23,3,"Then Abraham rose from beside his dead wife and spoke to the Hittites. He , said,"
NIV,23,4,"""I am an alien and a stranger among you. Sell me some property for a burial site here so I can bury my dead."""
NIV,23,5,"The Hittites replied to Abraham,"
NIV,23,6,"""Sir, listen to us. You are a mighty prince among us. Bury your dead in the choicest of our tombs. None of us will refuse you his tomb for burying your dead."""
NIV,23,7,"Then Abraham rose and bowed down before the people of the land, the Hittites."
NIV,23,8,"He said to them, ""If you are willing to let me bury my dead, then listen to me and intercede with Ephron son of Zohar on my behalf"
NIV,23,9,"so he will sell me the cave of Machpelah, which belongs to him and is at the end of his field. Ask him to sell it to me for the full price as a burial site among you."""
NIV,23,10,Ephron the Hittite was sitting among his people and he replied to Abraham in the hearing of all the Hittites who had come to the gate of his city.
NIV,23,11,"""No, my lord,"" he said. ""Listen to me; I give you the field, and I give you the cave that is in it. I give it to you in the presence of my people. Bury your dead."""
NIV,23,12,Again Abraham bowed down before the people of the land
NIV,23,13,"and he said to Ephron in their hearing, ""Listen to me, if you will. I will pay the price of the field. Accept it from me so I can bury my dead there."""
NIV,23,14,"Ephron answered Abraham,"
NIV,23,15,"""Listen to me, my lord; the land is worth four hundred shekels of silver, but what is that between me and you? Bury your dead."""
NIV,23,16,"Abraham agreed to Ephron's terms and weighed out for him the price he had named in the hearing of the Hittites: four hundred shekels of silver, according to the weight current among the merchants."
NIV,23,17,"So Ephron's field in Machpelah near Mamre-both the field and the cave in it, and all the trees within the borders of the field-was deeded"
NIV,23,18,to Abraham as his property in the presence of all the Hittites who had come to the gate of the city.
NIV,23,19,Afterward Abraham buried his wife Sarah in the cave in the field of Machpelah near Mamre (which is at Hebron) in the land of Canaan.
NIV,23,20,So the field and the cave in it were deeded to Abraham by the Hittites as a burial site.
NIV,24,1,"Abraham was now old and well advanced in years, and the Lord had blessed him in every way."
NIV,24,2,"He said to the chief servant in his household, the one in charge of all that he had, ""Put your hand under my thigh."
NIV,24,3,"I want you to swear by the Lord , the God of heaven and the God of earth, that you will not get a wife for my son from the daughters of the Canaanites, among whom I am living,"
NIV,24,4,"but will go to my country and my own relatives and get a wife for my son Isaac."""
NIV,24,5,"The servant asked him, ""What if the woman is unwilling to come back with me to this land? Shall I then take your son back to the country you came from?"""
NIV,24,6,"""Make sure that you do not take my son back there,"" Abraham said."
NIV,24,7,"""The Lord , the God of heaven, who brought me out of my father's household and my native land and who spoke to me and promised me on oath, saying, 'To your offspring I will give this land'-he will send his angel before you so that you can get a wife for my son from there."
NIV,24,8,"If the woman is unwilling to come back with you, then you will be released from this oath of mine. Only do not take my son back there."""
NIV,24,9,So the servant put his hand under the thigh of his master Abraham and swore an oath to him concerning this matter.
NIV,24,10,"Then the servant took ten of his master's camels and left, taking with him all kinds of good things from his master. He set out for Aram Naharaim and made his way to the town of Nahor."
NIV,24,11,"He had the camels kneel down near the well outside the town; it was toward evening, the time the women go out to draw water."
NIV,24,12,"Then he prayed, ""O Lord , God of my master Abraham, give me success today, and show kindness to my master Abraham."
NIV,24,13,"See, I am standing beside this spring, and the daughters of the townspeople are coming out to draw water."
NIV,24,14,"May it be that when I say to a girl, 'Please let down your jar that I may have a drink,' and she says, 'Drink, and I'll water your camels too'-let her be the one you have chosen for your servant Isaac. By this I will know that you have shown kindness to my master."""
